Sheet: Compucalc 2
A1: Timeline | B1: Incumbator Planting Time (s) | C1: Predicted Planting Time (s) | D1: Planting Time (s) | E1: Reaping Time (s) | F1: https://3cfv.jimdofree.com
A2: 2 | B2: 3117330.0266000004 | F2: Request your file now to predict crop growth
A3: 4 | B3: 1470590.9086025064 | F3: E: solomon.ubani3@mail.dcu.ie
A4: 6 | B4: 2513941.0909090908 | C4: 2513941.0909090908 | D4: 2513941.0909090908 | E4: 2513941.0909090908 | F4: Sample Values have been filled in for guide. Please feel free to put your crops counting from July 31st
A5: 8 | C5: =FORECAST.ETS(RC[-2],R2C2:R4C2,R2C1:R4C1,1,1) -> #N/A | D5: =RC[-1]-FORECAST.ETS.CONFINT(RC[-3],R2C2:R4C2,R2C1:R4C1,0.95,1,1) -> #N/A | E5: =RC[-2]+FORECAST.ETS.CONFINT(RC[-4],R2C2:R4C2,R2C1:R4C1,0.95,1,1) -> #N/A

Sheet: Sheet1
A1: 2 | B1: =(32+32)/2 -> 32 | C1: =(262144+262144)/2 -> 262144 | D1: =(365+365)/2 -> 365 | E1: =(1.042+1.042)/2 -> 1.042 | F1: =(833.3333+833.3333)/2 -> 833.33330000000001 | G1: =(((RC[-4]*RC[-3])/(RC[-5]))*RC[-2])+(RC[-1]*RC[-6]) -> 3117330.0266000004
A2: 4 | B2: =(80.92132+80.92132)/2 -> 80.921319999999994 | C2: =(521859.4+278000)/2 -> 399929.7 | D2: =(78.31168+202.7)*2 -> 562.02335999999991 | E2: =(0.528+0.528)/2 -> 0.52800000000000002 | F2: =(1000+1000)/2 -> 1000 | G2: =(((RC[-4]*RC[-3])/(RC[-5]))*RC[-2])+(RC[-1]*RC[-6]) -> 1470590.9086025064
A3: 6 | B3: =(69.5+57)/2 -> 63.25 | C3: =(1200000+720000)/2 -> 960000 | D3: =(240.6+270)/2 -> 255.3 | E3: =(0.648+0.648)/2 -> 0.64800000000000002 | F3: =(500+500)/2 -> 500 | G3: =(((RC[-4]*RC[-3])/(RC[-5]))*RC[-2])+(RC[-1]*RC[-6]) -> 2513941.0909090908